{
  "schema_version": 2,
  "direction": "work_to_gpu",
  "workflow_kind": "adsorption",
  "handoff_id": "fe110_five_c2_20261007_03_extra2_repair_v1",
  "source_workflow_sha256": "a9314ff123d76e85142dda446ef75fb3f03b5a5210b91d67f482d5f87a290328",
  "candidate_structure": {
    "path": "POSCAR",
    "sha256": "08c070b90b29aaba2b405f32420478af9fe72938eab6982557971564345edd03",
    "format": "vasp_poscar",
    "atom_count": 49,
    "atom_order_sha256": "4b02a989fb2bb78573d64099687209cfb3886d4d70b1d4c0a407cd9f5b76c1a2"
  },
  "compatibility": {
    "branch": "true_fe110_5layer_5x5x1",
    "slab_model": "true_fe110_fe45_5layer",
    "facet": "110",
    "sha256": "851922b78e5e64b4afae7dfc7437af7cee2894491a50a01da3f5be26dcf0b593"
  },
  "model": {
    "identifier": "AQCat25 demo_single model.pt",
    "checkpoint_sha256": "e1f14d50590102dbdf64491a6ae328df6ba0ca2ebb947fbe72213820ae67eb50",
    "fmax_eV_per_A": 0.1,
    "max_steps": 80
  },
  "selective_dynamics": {
    "fixed_atom_indices_1based": [
      1,
      2,
      3,
      4,
      5,
      6,
      7,
      8,
      9,
      10,
      11,
      12,
      13,
      14,
      15,
      16,
      17,
      18
    ],
    "free_atom_count": 31
  },
  "adsorption": {
    "evidence_gated_plan_sha256": "a9314ff123d76e85142dda446ef75fb3f03b5a5210b91d67f482d5f87a290328",
    "clean_slab_sha256": "3337ad4e89a2719551035fadbd5082a60c12cafcadc14748d8b48a198379109d",
    "identity_and_connectivity": "QEJQAPYSVNHDJF-UHFFFAOYSA-N* [CH][C][O]",
    "intended_motif": "{\"name\": \"03_extra2_repair_v1\", \"species_id\": \"03\", \"anchor_global_0based\": 46, \"site\": \"short_bridge\", \"azimuth_deg\": 0.0, \"tilt_deg\": 0.0, \"axis_from\": 46, \"axis_to\": 45, \"binding_distance_A\": 2.2, \"hypothesis\": \"Central C46 anchors at short bridge; intact CH-C-O chain parallel to long Fe rows, without pulling its two carbons toward opposed transverse sites.\"}",
    "surface_elements": [
      "Fe"
    ],
    "adsorbate_atoms": [
      {
        "index_1based": 46,
        "symbol": "C",
        "role": "anchor"
      },
      {
        "index_1based": 47,
        "symbol": "C",
        "role": "anchor"
      },
      {
        "index_1based": 48,
        "symbol": "O",
        "role": "anchor"
      },
      {
        "index_1based": 49,
        "symbol": "H",
        "role": "non_anchor"
      }
    ],
    "connectivity_constraints": [],
    "monitored_pairs": [
      {
        "label": "adsorbate_46_47",
        "atoms_1based": [
          46,
          47
        ]
      },
      {
        "label": "adsorbate_46_48",
        "atoms_1based": [
          46,
          48
        ]
      },
      {
        "label": "adsorbate_46_49",
        "atoms_1based": [
          46,
          49
        ]
      },
      {
        "label": "adsorbate_47_48",
        "atoms_1based": [
          47,
          48
        ]
      },
      {
        "label": "adsorbate_47_49",
        "atoms_1based": [
          47,
          49
        ]
      },
      {
        "label": "adsorbate_48_49",
        "atoms_1based": [
          48,
          49
        ]
      }
    ]
  },
  "restrictions": {
    "predicted_candidate_only": true,
    "submit_vasp": false,
    "scientific_acceptance": false,
    "direct_gpu_to_vasp_handoff": false
  }
}
