{
  "schema_version": 2,
  "direction": "work_to_gpu",
  "workflow_kind": "adsorption",
  "handoff_id": "fe110_five_c2_20261006_supplement_02_extra1",
  "source_workflow_sha256": "1fc033d0b4c276466508ff4d4cc2899b82351c9052fec8ab09483b506eac7938",
  "candidate_structure": {
    "path": "POSCAR",
    "sha256": "5e82ab88edcac7e5128b17c5298c0a08f462ae77a1be790c5a4934d687d4a384",
    "format": "vasp_poscar",
    "atom_count": 49,
    "atom_order_sha256": "76930a387fb98f94524fe9cab4559a75a609e5ba93be2093ba9ef044f6bf1f99"
  },
  "compatibility": {
    "branch": "true_fe110_5layer_5x5x1",
    "slab_model": "true_fe110_fe45_5layer",
    "facet": "110",
    "sha256": "851922b78e5e64b4afae7dfc7437af7cee2894491a50a01da3f5be26dcf0b593"
  },
  "model": {
    "identifier": "AQCat25 demo_single model.pt",
    "checkpoint_sha256": "e1f14d50590102dbdf64491a6ae328df6ba0ca2ebb947fbe72213820ae67eb50",
    "fmax_eV_per_A": 0.1,
    "max_steps": 80
  },
  "selective_dynamics": {
    "fixed_atom_indices_1based": [
      1,
      2,
      3,
      4,
      5,
      6,
      7,
      8,
      9,
      10,
      11,
      12,
      13,
      14,
      15,
      16,
      17,
      18
    ],
    "free_atom_count": 31
  },
  "adsorption": {
    "evidence_gated_plan_sha256": "1fc033d0b4c276466508ff4d4cc2899b82351c9052fec8ab09483b506eac7938",
    "clean_slab_sha256": "3337ad4e89a2719551035fadbd5082a60c12cafcadc14748d8b48a198379109d",
    "identity_and_connectivity": "SNVLJLYUUXKWOJ-UHFFFAOYSA-N* [C][CH2]",
    "intended_motif": "{\"site\": \"long_bridge\", \"anchor_global_0based\": 46, \"azimuth_deg\": 0.0, \"tilt_deg\": 35.0, \"hypothesis\": \"bare C at long bridge, intact CH2 end tilted outward along the long Fe-row direction\"}",
    "surface_elements": [
      "Fe"
    ],
    "adsorbate_atoms": [
      {
        "index_1based": 46,
        "symbol": "C",
        "role": "anchor"
      },
      {
        "index_1based": 47,
        "symbol": "C",
        "role": "anchor"
      },
      {
        "index_1based": 48,
        "symbol": "H",
        "role": "non_anchor"
      },
      {
        "index_1based": 49,
        "symbol": "H",
        "role": "non_anchor"
      }
    ],
    "connectivity_constraints": [],
    "monitored_pairs": [
      {
        "label": "adsorbate_46_47",
        "atoms_1based": [
          46,
          47
        ]
      },
      {
        "label": "adsorbate_46_48",
        "atoms_1based": [
          46,
          48
        ]
      },
      {
        "label": "adsorbate_46_49",
        "atoms_1based": [
          46,
          49
        ]
      },
      {
        "label": "adsorbate_47_48",
        "atoms_1based": [
          47,
          48
        ]
      },
      {
        "label": "adsorbate_47_49",
        "atoms_1based": [
          47,
          49
        ]
      },
      {
        "label": "adsorbate_48_49",
        "atoms_1based": [
          48,
          49
        ]
      }
    ]
  },
  "restrictions": {
    "predicted_candidate_only": true,
    "submit_vasp": false,
    "scientific_acceptance": false,
    "direct_gpu_to_vasp_handoff": false
  }
}
