{
  "schema_version": 2,
  "direction": "work_to_gpu",
  "workflow_kind": "adsorption",
  "handoff_id": "fe110_five_c2_20261006_supplement_01_extra1",
  "source_workflow_sha256": "1fc033d0b4c276466508ff4d4cc2899b82351c9052fec8ab09483b506eac7938",
  "candidate_structure": {
    "path": "POSCAR",
    "sha256": "a550e6519ac1378e896733416a989401b47a457361fc893ff89982b86589ac1d",
    "format": "vasp_poscar",
    "atom_count": 48,
    "atom_order_sha256": "6f7e099977a9a01eb9156d57130c817a3001d7d47102edce3236e47c72d9b031"
  },
  "compatibility": {
    "branch": "true_fe110_5layer_5x5x1",
    "slab_model": "true_fe110_fe45_5layer",
    "facet": "110",
    "sha256": "851922b78e5e64b4afae7dfc7437af7cee2894491a50a01da3f5be26dcf0b593"
  },
  "model": {
    "identifier": "AQCat25 demo_single model.pt",
    "checkpoint_sha256": "e1f14d50590102dbdf64491a6ae328df6ba0ca2ebb947fbe72213820ae67eb50",
    "fmax_eV_per_A": 0.1,
    "max_steps": 80
  },
  "selective_dynamics": {
    "fixed_atom_indices_1based": [
      1,
      2,
      3,
      4,
      5,
      6,
      7,
      8,
      9,
      10,
      11,
      12,
      13,
      14,
      15,
      16,
      17,
      18
    ],
    "free_atom_count": 30
  },
  "adsorption": {
    "evidence_gated_plan_sha256": "1fc033d0b4c276466508ff4d4cc2899b82351c9052fec8ab09483b506eac7938",
    "clean_slab_sha256": "3337ad4e89a2719551035fadbd5082a60c12cafcadc14748d8b48a198379109d",
    "identity_and_connectivity": "XEHVFKKSDRMODV-UHFFFAOYSA-N* [C][CH]",
    "intended_motif": "{\"site\": \"long_bridge\", \"anchor_global_0based\": 46, \"azimuth_deg\": 0.0, \"tilt_deg\": 25.0, \"hypothesis\": \"bare C at long bridge, CH end tilted outward along the long Fe-row direction\"}",
    "surface_elements": [
      "Fe"
    ],
    "adsorbate_atoms": [
      {
        "index_1based": 46,
        "symbol": "C",
        "role": "anchor"
      },
      {
        "index_1based": 47,
        "symbol": "C",
        "role": "anchor"
      },
      {
        "index_1based": 48,
        "symbol": "H",
        "role": "non_anchor"
      }
    ],
    "connectivity_constraints": [],
    "monitored_pairs": [
      {
        "label": "adsorbate_46_47",
        "atoms_1based": [
          46,
          47
        ]
      },
      {
        "label": "adsorbate_46_48",
        "atoms_1based": [
          46,
          48
        ]
      },
      {
        "label": "adsorbate_47_48",
        "atoms_1based": [
          47,
          48
        ]
      }
    ]
  },
  "restrictions": {
    "predicted_candidate_only": true,
    "submit_vasp": false,
    "scientific_acceptance": false,
    "direct_gpu_to_vasp_handoff": false
  }
}
